{
  "evidence_report_id": "evidence-report-pcram-delta-2026-05-20",
  "schema_version": "1.0.0",
  "title": "PCRAM Delta Evidence Report (Sample)",
  "report_ref": "reports/example-pcram-delta-report.md",
  "report_hash": "sha256:aaaaaaaaaaaaaaaaaaaaaaaaaaaaaaaaaaaaaaaaaaaaaaaaaaaaaaaaaaaaaaaa",
  "created_at": "2026-05-21T10:10:00.000Z",
  "source_version_refs": ["source-version-pcram-bulletin-2026-05-20t120000z"],
  "review_manifest_ref": "review-manifest-pcram-delta-2026-05-20",
  "approved_artifact_ref": "approved-artifact-pcram-delta-2026-05-20",
  "jurisdiction_scope": ["AR"],
  "report_type": "regulatory_delta_evidence",
  "risk_level": "medium",
  "human_review_required": true,
  "limitations": [
    "Sample metadata for schema validation only.",
    "No production integration or external connectivity."
  ],
  "summary": "Metadata index for PCRAM delta evidence markdown report.",
  "affected_codes": ["0101.29.00"],
  "profile_context_used": ["broker-profile-sample-ar-generalist"],
  "evidence_refs": [
    "snapshots/pcram/example-approved-artifact.json",
    "snapshots/pcram/example-review-manifest.json"
  ],
  "producer": "pcram-evidence-metadata-indexer",
  "valid_until": "2026-12-31T23:59:59.000Z",
  "metadata": {
    "environment": "local",
    "report_family": "pcram"
  }
}
